"a a a!","ha ha ha! "
"olin","noun: love "
"olin sina li ' pona, tawa mi.","Your love is good for me. "
"olin suli li ' awen.","Old love never rusts. "
"olin","to love (a person) "
"o lukin e ni!","Watch this! "
"o lukin e pipi loje ni!","Look at that red bug. "
"o moli e pipi, kepeken palisa.","Kill the roach with the stick. "
"ona anu jan ante li ' ike?","Is he bad, or is it the other person who's bad? "
"ona li anpa e moli.","She defeated death. "
"(ona) li ike","(she/he/it) is bad, I don't like (her/him/it) "
"ona li ' jan pi pona lukin ala ' jan pi pona lukin?","Is she an attractive person? "
"ona li ' jan pona pi kalama musi.","He is a good musician. "
"ona li jo e seme?","What does he have? "
"ona li kama, tawa ma mi.","He's coming to my country. "
"ona li kama, tawa tomo mi.","He came to my house. "
"ona li kasi ala kasi?","Is it growing? "
"ona li kule ala kule e len?","Does she dye the dress? "
"ona li kule e tomo tawa.","He's painting the car. "
"ona li lawa e jan, tawa ma pona.","He led people to the good land. "
"","ona li lawa utala e utala. "
"ona li lawa utala e utala.","He leads fightingly the battle. "
"ona li len lili e ona.","She was barely dressed. "
"ona li ' linja anu seme?","Is it a chain? "
"ona li ' loje anu seme?","Is it red? "
"ona li ' lon ala.","It has no existence. "
"ona li lon ala lon tomo?","Is he in the house? "
"ona li ' lon pi nasin sewi.","It's a sacred existence. "
"ona li lon sewi mi.","He is in my above, i.e. he is above me. "
"ona li lon tenpo ni li lon tomo ni.","He's here during this time and in this house. "
"ona li lukin, sama pipi.","He looks like a bug. "
"ona li mama ala mama e sina?","Does she mother you? "
"ona li ' mama ala ' mama ?","Is she a parent? "
"ona li ' mama anu seme?","Is she a mother (or what)? "
"ona li moku e kili.","She's eating fruit. "
"ona li ' moku.","It is food. "
"ona li moku, lon tenpo ni li moku, lon tenpo kama.","He eats now and he eats later. "
"ona li mute ike mute e jo.","She increases the property very badly. "
"ona li namako ala namako?","Did she season? "
"ona li nanpa e jan.","He counts people. "
"ona li pali e ni, kepeken nasin seme?","How did she make that? "
"ona li pali, lon tomo pali li moku, lon tomo moku.","He works in the office and eats in the canteen. "
"ona li pan ala pan?","Does he sow? "
"ona li pan e pan.","They're sowing the grain. "
"ona li pona e ilo, lon tomo ona.","He repairs the tools in his house. "
"ona li pona e ilo.","She's fixing the machine. "
"(ona) li pona","(he/she/it) is good, I like (him/her/it) "
"ona li pona ike mute e ilo.","He was very bad at fixing the machine. "
"ona li ' pona li ' lili.","It is good and is small. "
"ona li ' pona li unpa.","He's awesome and has sex. "
"ona li ' pona.","She's good. "
"ona li selo ala selo?","Is it protecting? "
"(ona) li seme?","what is (she/he) like? "
"ona li sike ala sike?","Is it rotating? "
"ona li sitelen ala sitelen?","Does he draw? "
"ona li tawa ala, tawa telo.","He didn't go to the lake. "
"ona li tawa, tawa sewi kiwen.","She's going up the rock. "
"ona li telo e ona.","He washes himself. "
"ona li telo e ona.","She washes herself. "
"ona li toki sitelen e ni.","She says this very figuratively. "
"ona li wile e ni: jan li pakala ala e ma e telo e kon.","They don't want people to destroy the environment. "
"ona li wile jo e ilo.","He would like to have a tool. "
"ona li wile moku e telo.","She is thirsty. "
"ona li wile mute e ni.","He wants that a lot. "
"ona li wile pakala e ilo.","He wants to destroy the tool. "
"ona mute li nasa e jan suli.","They drove the adults crazy. "
"ona mute li tawa, tawa utala.","They're going to the war. "
"ona mute li utala toki.","They are arguing. "
"ona mute","they, them "
"ona","personal pronoun: she, he, it, they "
"ona","possessive pronoun: her, his, its "
"Ontula","Honduras "
"o olin e jan poka.","Love thy neighbour. "
"o open e lupa!","Open the door. "
"o pali!","Work! "
"o pana e namako, tawa mi.","Give me some spice. "
"o pana e pona tawa ma.","Love the earth. Take care of our planet. "
"o pana e sike, tawa mi.","Give the ball to me. "
"o pana e sitelen ma, tawa mi.","Give me the map. "
"o pana e suwi, tawa mi!","Give me a lollipop! "
"open","adjective: initial, starting, opening "
"open","auxiliary verb: to begin, to start "
"open (e )","verb transitive: to open, to start, to begin, to turn on "
"open la ala li lon!","There was nothing in the beginning! "
"open la","noun: at the opening, in the beginning "
"open","noun: start, beginning, opening "
"o pilin e nena.","Touch the button. "
"o pilin e uta mi, kepeken uta sina!","Kiss me. "
"o ' pona!","Be good! "
"o pu!","Buy and read the official Toki Pona book! "
"Osalasi","Austria "
"Oselija","Australia "
"o !","separator: An 'o' is used for imperative (commands): 'o' replace 'li'. "
"o sona ala. o pali.","Stop thinking. Do stuff. "
"o sona e sina!","Know thyself! "
"o !","subject: An 'o' is used for imperative (commands). 'o' replace the subject. "
"o tawa!","Go! "
"o tawa musi, lon poka mi!","Dance with me! "
"o tawa, tawa ma tomo, lon poka jan pona sina!","Go to the city with your friend! "
"o tawa weka ala e sina!","Don't move away! "
"o tu.","Break up. Split apart. "
"o tu e palisa ni.","Split this stick. "
"o wan!","Unite! "
"o weka e jan lili, tan ni.","Remove the kid from here "
"o weka e len sina.","Remove your clothes. "
"pakala","adjective: destroyed, ruined, demolished, shattered, wrecked "
"pakala","adverb: destroyed, ruined, demolished, shattered, wrecked "
"pakala (e )","verb transitive: to screw up, to ruin, to break, to hurt, to injure, to damage "
"pakala!","F-ck! "
"pakala!","F-ck! D-mn! "
"pakala!","interjection: damn! fuck! "
"pakala moli li kama, tawa sina.","The deadly battle comes to you. "
"pakala","noun: blunder, accident, mistake, destruction, damage, breaking "
"pakala","verb intransitive: to screw up, to fall apart, to break "
"Pakisan","Pakistan "
"Palakawi","Paraguay "
"Palani","Bahrein "
"Palata","India "
"pali","adjective: active, work-related, operating, working "
"pali","adverb: actively, briskly "
"pali ala","not working "
"pali e ike tawa","to do bad things to, to show disrespect for "
"pali (e )","verb transitive: to do, to make, to build, to create "
"pali li pana e sona.","One learns by experience. "
"pali","noun: activity, work, deed, project "
"pali","occupations "
"pali pona li lawa, tawa lon.","Good work is most importand in live. / Order is the half of the live. "
"palisa","adjective: long "
"palisa (e )","verb transitive: to stretch, to beat, to poke, to stab, to sexually arouse "
"palisa lili noka","toes "
"palisa luka","finger "
"palisa mije li lawa e mije.","A man's penis control him. "
"palisa (mije)","penis "
"palisa mije","penis "
"palisa","noun: long hard thing; branch, rod, stick, pointy thing "
"palisa","penis-shaped thing, e.g. dildo "
"palisa sina li kiwen","your cock is hard "
"palisa tawa","vibrating dildo "
"palisa uta","tongue "
"pali","verb intransitive: to act, to work, to function "
"pali","Work "
"pana","adjective: generous "
"pana e ko jaki","to pooh, to shit "
"pana e kon (pi pilin) pona","to laugh "
"pana e moku tawa","to feed, nourish "
"pana e palisa lon lupa","to penetrate "
"pana e palisa uta lon","to lick "
"pana e pilin pona tawa","to send positivity to, make feel good "
"pana e sona","to teach (give knowledge) "
"pana e telo jelo","to pee, to urinate "
"pana e telo oko","to cry, weep "
"pana e telo (walo) mije","to ejaculate "
"pana e uta lon lupa (meli)","to perform cunnilingus "
"pana e uta lon palisa","to fellate "
"pana (e )","verb transitive: to give, to put, to send, to place, to release, to emit, to cause "
"Panama","Panama "
"pana","noun: giving, transfer, exchange "
"pana wawa","BDSM "
"pan (e )","verb transitive: to sow "
"Panla","Bangladesh, Bengali "
"pan ni li ' moku ike.","This pasta is unappetizing. "
"pan","noun: cereal, grain; barley, corn, oat, rice, wheat; bread, pasta "
"Papeto","Barbados "
"Papuwanijukini","Papua New Guinea "
"","Pardon? "
"Pasila","Brasil "
"Pawama","Bahamas "
"Pelalusi","Belarus, Belarussian "
"Pelu","Peru "
"Pemuta","Bermuda "
"Penesuwela","Venezuela "
"Penin","Benin "
"Pesije","Belgium "
"pilin","adjective: sensitive, feeling, empathic "
"pilin","adverb: perceptively "
"pilin ala","indifferent, unfeeling "
"pilin e ike jan","to pity somebody, feel bad for somebody "
"pilin e moli jan","to mourn somebody "
"pilin (e )","verb transitive: to feel, to think, to touch, to fumble, to fiddle "
"pilin e weka jan","to miss somebody "
"pilin","feelings "
"pilin","feelings, emotions, to feel, heart "
"pilin","heart "
"pilin ike tan","be afraid of, sad because of, regret, be offended by "
"pilin ike tawa","to have negative feelings for, be upset at, angry at, hate, resent "
"pilin ike","to feel bad, sad, depressed, unhappy, bitter, discontented, grumpy "
"pilin ike wawa","to have intense negative feelings, be pissed off, furious "
"pilin nasa","drunk, high "
"pilin nasa","to feel silly, strange, weird, crazy, drunk, high "
"pilin","noun: feelings, emotion, feel, think, sense, touch, "
"pilin pona li pana e sijelo pona.","Positive feelings grant good health. Mind over matter. "
"pilin pona mute","to feel great, amazing, awesome "
"pilin pona tan","to feel good because of, to enjoy "
"pilin pona","to feel good, happy, content, enjoy oneself, comfortable "
"pilin","to feel, touch "
"pilin","verb intransitive: to feel, to sense "
"pilin wawa","to feel strong, energetic, excited, confident, proud "
"pilin wawa (unpa)","orgasm "
"Pilipina","Philipines, Tagalog "
"Pilisin","Palestine "
"pimeja","adjective: black, dark "
"pimeja","black, dark "
"pimeja (e )","verb transitive: to darken "
"pimeja laso","blueish black "
"pimeja","noun: darkness, shadows "
"pini","adjective: completed, finished, past, done "
"pini","adverb: ago, past, perfectly "
"pini","auxiliary verb: to stop, to finish, to end, to interrupt "
"pini (e )","verb transitive: to end, to stop, to turn off, to finish, to close "
"pini li ' pona la ale li ' pona.","Is the end good -- everything is good. "
"pini","noun: end, tip "
"pini palisa","glans, head of the penis "
"pini pi nena mama","nipples "
"pipi li ' ike, tawa mi.","I hate spiders. "
"pipi li lon ala lon poka mi?","Is a bug beside me? "
"pipi li lon anpa mi.","The bug is underneath me. "
"pipi li moku ala moku e kili?","Are the bugs eating the fruit? "
"pipi li moku e kasi.","Bugs eat plants. "
"pipi li moku e mi.","The mosquito bit me. "
"pipi li mu e kalama.","The cicadas are chirping noises. "
"pipi li mu, tawa ona.","The beetles communicate with each other. "
"pipi","noun: bug, insect, spider "
"pipi pi ma mama mi li ' lili.","The insects of my homeland are small. "
"pipi seme li pakala e sina?","Which bug hurt you? "
"pi","separator: 'pi' is used to build complex compound nouns. 'pi' separates a (pro)noun from another (pro)noun that has at least one adjective. After 'pi' could only be a noun or pronoun. "
"Pisi","Fiji "
"Piten","Britain, UK "
"poka","adjective: neighbouring "
"poka","hip "
"poka mi li ' pakala.","My hip hurts. "
"poka","noun: side, hip, next to "
"poka pi luka sitelen ala","left side, left "
"poka pi luka sitelen","right side, right "
"Pokasi","Bulgaria, Bulgarian "
"poka sina la mi tawa.","If at your side, I walk. / I'll walk beside you. "
"poka telo","water side, the beach "
"poki (e )","verb transitive: to box up, to put in, to can, to bottle "
"poki","glass, cup, bottle, bowl, container "
"poki kon","lungs "
"poki lete","refrigerator "
"poki ni li lon jaki.","That bottle is in the dirt. "
"poki","noun: container, box, bowl, cup, glass "
"poki seli","oven, microwave "
"poki telo","sink, bathtub "
"pona","adjective: good, simple, positive, nice, correct, right "
"pona","adverb: good, simple, positive, nice, correct, right "
"pona e pilin jan","cheer up, make somebody happy "
"pona (e )","verb transitive: to improve, to fix, to repair, to make good "
"pona!","interjection: great! good! thanks! OK! cool! yay! "
"pona la","noun: if good, if simplicity, if positivity "
"pona la sina jo e mani.","Fortunately, you have money. "
"pona la sina jo e mani.","Luckily, you have money. "
"pona li kama ala kama?","Is the good coming? "
"pona li kama.","The good will come. "
"pona lukin","beautiful, pretty, handsome "
"pona lukin","pretty, attractive "
"pona moku","delicious, tasty "
"pona","noun: good, simplicity, positivity "
"pona unpa","sexy, good in bed "
"pona!","Yay! Good! Hoorah! "
"Posan","Bosnia and Herzegovina, Bosnian "
"Posuka","Poland, Polish "
"Potuke","Portugal, Portugese "
"pu","adjective: buying and interacting with the official Toki Pona book "
"pu","auxiliary verb: to buying and interacting with the official Toki Pona book "
"pu (e )","verb transitive: to apply (the official Toki Pona book) to "
"pu","noun: buying and interacting with the official Toki Pona book "
"pu","verb intransitive: to buy and to read (the official Toki Pona book) "
"sama","adjective: same, similar, equal, of equal status or position "
"sama","adverb: just as, equally, exactly the same, just the same, similarly "
"sama (e )","verb transitive: to equate, to make equal, to make similar to "
"sama la","noun: in case of equality, if parity, on identity "
"sama la sina en mi li utala ala.","In case of equality we don't fight. "
"sama la sina en mi li utala ala.","We don't fight on parity. "
"sama li ' ike.","Equality is bad. "
"Samalino","San Marino "
"sama","noun: equality, parity, equity, identity, par, sameness "
"sama ona la sina ken ante e ni.","If it's the same, you can swap it. "
"sama pi ni en ona la mi wile jo e ni tu.","If this and that is the same, I want both."
"sama","preposition: like, as, seem "
"Sameka","Jamaica, Jamaican Patoi "
"Samowa","Samoa "
"Sasali","Algeria "
"Sawa","Java, Javanese "
"Sawasi","Swaziland "
"Seki","Czech (Republic) "
"seli","adjective: hot, warm, cooked "
"seli","adverb: hot, warm, cooked "
"seli (e )","verb transitive: to heat, to warm up, to cook "
"seli lili li lon.","It's warm. "
"seli li lon.","It's hot. "
"seli li lon","it's warm or hot "
"seli li lon la mi pana e telo, tan selo mi.","When it's hot, I sweat. "
"seli mute li lon.","It's very hot. "
"seli","noun: fire, warmth, heat "
"seli suno li seli e tomo mi.","The sun's warmth heats my home. "
"selo (e )","verb transitive: to shelter, to protect, to guard "
"selo lon pini palisa","foreskin "
"selo mi li wile e ni: mi pilin e ona.","My skin wants this: I touch it. "
"selo","noun: skin, outer form, bark, peel, shell, skin, boundary, shape "
"selo","skin "
"seme la sina pali e ni?","Under what conditions will you do this? "
"seme la telo kama, tan sewi?","Under what conditions does it rain? "
"seme li lon poka mi?","Who/What is beside me? "
"seme li lon tomo mi?","Who/What is in my house? "
"seme li moku e kili mi?","Who/What is eating my fruit? "
"seme li ' pona, tawa sina?","Who/What do you like? "
"seme li utala e sina?","Who/What attacked you? "
"seme?","Pardon? "
"seme","question pronoun: what, which, wh- (question word) "
"Seneka","Senegal "
":","separator: A colon is between an hint sentences and a sentences. Before and after the colon has to be complete sentences. Don't use a colon before or after "
",","separator: A comma is used after an 'o' to addressing people. Optional you can put a comma before a preposition. Don't use a comma before or after "
".","separator: A declarative sentence ends with a full stop. Don't use a full stop before or after the other separators 'e', 'la', 'li', 'pi', '.', '!', '?', ':'. "
"!","separator: An imperative or an interjection sentence (exclamatory) ends with an exclamation mark. Don't use an exclamation mark before or after the other separators 'e', 'la', 'li', 'pi', '.', '!', '?', ':'. "
"?","separator: An question (interrogative sentence) always ends with a question mark. Don't use a question mark before or after the other separators 'e', 'la', 'li', 'o', 'pi', '.', '!', '?', ':'. "
""","separator: Quotation marks are used for words with original spelling or for quotes. "
"Setapika","South Africa "
"sewi","adjective: superior, elevated, religious, formal "
"sewi","adverb: superior, elevated, religious, formal "
"sewi (e )","verb transitive: to lift "
"sewi li ' laso.","The sky is blue. "
"sewi monsi","upper back, shoulders "
"sewi","noun: high, up, above, top, over, on "
"sewi pi sinpin lawa","forehead "
"sewi","verb intransitive: to get up "
"","She increases the property very badly. "
"","She's good. "
"","She was barely dressed. "
"sijelo","adjective: physical, bodily, corporal, corporeal, material, carnal "
"sijelo","adverb: physically, bodily "
"sijelo","body "
"sijelo (e )","verb transitive: to heal, to heal up, to cure "
"sijelo","Health "
"sijelo","noun: body (of person or animal), physical state, torso "
"sike","adjective: round, cyclical, of one year "
"sike","adverb: rotated "
"sike (e )","verb transitive: to orbit, to circle, to revolve, to circle around, to rotate "
"sike mama waso","egg "
"sike mije","man's testicles "
"sike mije (tu)","testicles, balls "
"sike","noun: circle, ball, cycle, sphere, wheel; round or circular thing "
"sike tu","bicycle "
"Sile","Chile "
"sin","adjective: new, fresh, another, more "
" sin","adverb: regenerative "
"sina jo e kili anu telo nasa?","Do you have the fruit, or is it the wine that you have? "
"sina kama anu seme?","Are you coming or what? "
"sina kama e ni: mi wile moku.","You caused this: I want to eat. You made me hungry. "
"sina kama jo e jan pona, lon ni.","You will get friends there. "
"sina kama, tan ma seme?","Which country do you come from? "
"sina kama, tan seme?","Why did you come? "
"sina ken ala ken kama?","Can you come? "
"sina ken ala ken lape?","Can you sleep? "
"sina kepeken ala kepeken ilo?","Are you using the tool? "
"sina kepeken ala kepeken ni?","Are you using that? "
"sina kepeken seme?","What are you using? "
"","sina len nasa jaki e sina. "
"sina len nasa jaki e sina.","You dress disgustingly silly. "
"sina lon ala lon ma tomo Wankuwa?","Do you live in Vancouver? "
"sina lon ma tomo seme?","What city do you live in? "
"sina lon seme?","Where are you? "
"sina lukin ala lukin e kiwen?","Do you see the rock? "
"sina lukin ala lukin e sitelen tawa X-Files?","Do you watch The X-Files? "
"sina lukin e jan seme?","Whom did you see? "
"sina lukin e pipi.","You're watching a bug. "
"sina lukin e seme?","What are you watching? "
"sina lukin sewi e suno.","You look up at the sun. "
"","sina lukin unpa mute e mi. "
"sina lukin unpa mute e mi.","You're looking at me very sexy. "
"sina moku e telo nasa la sina nasa.","If you drink beer, you'll be silly. "
"sina ' moli la sina ken ala toki.","If you are dead, you can't speak. "
"sina o telo e sina!","Wash yourself! "
"sina pakala e ilo, kepeken nasin seme?","How did you break the tool? "
"sina pakala e seme?","What did you hurt? "
"sina pali e ni, kepeken nasin seme?","How did you make this? "
"sina pali e ni, kepeken seme?","What did you use to work on this? "
"sina pana ala pana e moku tawa jan lili?","Did you give food to the child? "
"sina pana e ike la sina kama jo e ike.","If you give evil, you will receive evil. "
"sina","personal pronoun: you "
"sina pilin e seme?","What are you thinking? "
"sina pilin seme?","how are you? how are you feeling? "
"sina pilin seme?","How do you feel? "
"sina ' pona ala ' pona?","Are you OK? "
"sina pona ala pona?","Are you OK? "
"sina pona ala pona e ilo?","Are you fixing the tool? "
"sina pona ala pona e sina? sina pona e sina anu seme?","Have you improved? "
"sina ' pona anu seme?","Are you OK (or what)? "
"sina pona pilin la ...","If You are Happy ... "
"sina ' pona.","You are good. "
"sina pona.","You fix. "
"sina","possessive pronoun: yours "
"sina sewi ala sewi?","Are you getting up? "
"sina sona ala sona e toki mi?","Do you understand what I'm saying? "
"sina sona e toki ni la sina sona e toki pona!","Figure this one out for yourself. :o) "
"sina ' suli a!","You are so tall! "
"sina ' suli.","You're tall. "
"sina suno mi.","You are My Sunshine. "
"sina tawa ala tawa, tan mi?","Are you leaving me? "
"sina tawa, lon poka pi jan seme?","Whom did you go with? "
"sina tawa ma tomo, tan seme?","Why did you go to the city? "
"sina tawa, tan mi.","You're leaving me. "
"sina telo e sina.","You wash yourself. "
"sina toki e ni, tawa mi: sina moku.","You told me that you are eating. "
"sina toki mu e ni.","You say that beastly. "
"sina toki, tawa jan seme?","Whom are you talking to? "
"sina toki, tawa mi anu ona?","Are you talking to me, or are you talking to him? "
"sina wile ala wile moku?","Do you want to eat? "
"sina wile ala wile pali? wile ala.","Do you want to work? No. "
"sina wile e mani anu seme?","Do you want the money or what? "
"sina wile e moku anu telo?","Do you want food, or do you want water? "
"sina wile jo e ilo moli la sina wile moli e jan.","If you want a gun, you want to kill people. "
"sina wile kama anu seme?","Do you want to come or what? "
"sina wile kama, tawa tomo toki.","You should come to the chat room. "
"sina wile kepeken ilo.","You have to use tools. "
"sina wile moku anu seme?","Do you want to eat or what? "
"sina wile pali e seme?","What do you want to do? "
"sina wile tawa, tawa ma seme?","What place do you want to go to? "
"sina wile tawa, tawa telo suli.","You want to go to the ocean. "
"sina wile toki e tan, tawa mi.","You have to tell me why. "
"sina wile toki, tawa mije anu meli?","Do you want to talk a male, or a female? "
"sin en ante li sin e lawa li pana e sona.","Novelty and change freshen the mind and bring insight. "
"sin (e )","verb transitive: to renew, to renovate, to freshen "
"Sinita","Trinidad and Tobago "
"sin","noun: news, novelty, innovation, newness, new release "
"sinpin","adjective: facial, frontal, anterior, vertical "
"sinpin","chest, abdomen, face "
"sinpin (lawa)","face "
"sinpin mi la tomo li lon.","In front of me is the house. "
"sinpin","noun: face, foremost, front, wall, chest, torso "
"Sipusi","Djibouti "
"sitelen","adjective: figurative, pictorial, metaphorical, metaphorisch "
"sitelen","adverb: pictorially "
"sitelen e toki","to write "
"sitelen (e )","verb transitive: to draw, to write "
"sitelen lape","dreams "
"sitelen ma","map "
"sitelen","noun: picture, image, representation, symbol, mark, writing "
"sitelen tawa 'Bowling for Columbine' li pona kin.","The movie 'Bowling for Columbine' is also good. "
"sitelen tawa 'Fahrenheit 9/11' li pona, tawa mi.","I like the movie 'Fahrenheit 9/11'. "
"sitelen tawa","movie, TV show "
"sitelen toki","writing "
"sitelen unpa","visual erotica, porn "
"sona","adjective: knowing, cognizant, shrewd "
"sona","auxiliary verb: to know how to "
"sona e toki","to know, speak, understand a language "
"sona (e )","verb transitive: to know, to understand, to know how to "
"sona mute","smart, intelligent, wise "
"sona","noun: knowledge, wisdom, intelligence, understanding "
"sona pona e toki","to master a language "
"sona","verb intransitive: to know, to understand "
"sona","Wisdom "
"Sonko","China, Chinese "
"Sopisi","Serbia, Serbian "
"soweli","adjective: animal "
"soweli li kama ala kama moli?","Is the dog dying? "
"soweli li kama moli.","The dog dies. "
"soweli lili li ' ike, tawa mi.","I'm allergic to cats. "
"soweli li toki e mu.","Cows say moo. "
"soweli","meat from a mammal, e.g. beef, pork "
"soweli mi li kama moli.","My dog is dying. "
"soweli ni li ' pona moku.","This cow is good to eat. "
"soweli","noun: animal, especially land mammal, lovable animal, beast "
"soweli pi poki sinpin","kangaroo "
"soweli waso","bat "
"Sukosi","Scotland, Scots "
"suli","adjective: big, tall, long, adult, important "
"suli","adverb: big, tall, long, adult, important "
"suli","big, tall, fat "
"suli (e )","verb transitive: to enlarge, to lengthen "
"Sulija","Syria "
"suli","noun: size "
"Sumi","Finland, Finnish "
"suno","adjective: sunny, sunnily "
"suno","adverb: sunny, sunnily "
"suno (e )","verb transitive: to light, to illumine "
"suno li ' jelo.","The sun is yellow. "
"suno li lon","it's sunny "
"suno li lon poka pimeja.","Light is beside darkness. Opposites are interconnected. Yin and yang. "
"suno li lon sewi mi.","The sun is above me. "
"suno li lon sewi.","The sun is in the sky. "
"suno li ' suli ala ' suli?","Is the sun big? "
"suno li ' suli.","The sun is big. "
"suno li suno seli e ma.","The sun shines warmly on the land. "
"suno li suno.","The sun is shining. "
"suno","noun: sun, light "
"suno pona!","Good sun! Good day! "
" supa","adjective: flat, shallow, flat-bottomed, horizontal "
"supa lape","bed "
"supa lawa","pillow "
"supa moku","dinner table "
"supa monsi","chair, couch "
"supa","noun: horizontal surface, e.g furniture, table, chair, pillow, floor "
"supa pali","work desk "
"supa","table, chair, sofa, ... "
"Sutan","Sudan "
"Suwasi","Switzerland, Swiss "
"suwi","adjective: sweet, cute "
"suwi (e )","verb transitive: to sweeten "
"suwi lukin","cute "
"suwi","noun: candy, sweet food "
"suwi","sweet "
"tan","adjective: causal, "
"tan ni la mi sona e nasin.","If this is the cause, we know the solution. "
"tan","noun: origin, cause "
"tan","preposition: from, by, because of, since "
"Tansi","Denmark, Danish "
"tan","verb intransitive: to come from, originate from, come out of "
"taso","adjective: only, sole "
"taso","adverb: only, just, merely, simply, solely, singly "
"taso","conjunction: but, however "
"taso ni la mi pilin pona.","But when that happens, I feel good. "
"taso ni la mi pilin pona.","But when this happens, I feel good. "
"taso tenpo pimeja pini la mi kama nasa.","But, Last night, I became drunk. "
"tawa","adjective: moving, mobile "
"tawa","adverb: moving, mobile "
"tawa (e )","verb transitive: to move, to displace "
"tawa mi la li ' pona, tawa mi.","It's good for me when I'm on the move. "
"tawa mi la mi pilin pona.","Am I in motion, I feel good. "
"tawa musi","dance (move entertainingly) "
